{
  "fco_id": "fco_3e151e054053602dc1367cadeee1c85711bf34da22cbb374823530602c8df342",
  "content_sha256": "3e151e054053602dc1367cadeee1c85711bf34da22cbb374823530602c8df342",
  "fco_type": "MODEL_ROUTE_FCO",
  "canonicalization": "RFC8785-like JSON: UTF-8, sorted keys, separators comma/colon, ensure_ascii=false",
  "execution_state": "SUPPORTED",
  "payload": {
    "task_class": "BOUNDED_SYNTHETIC_HEALTH_ADVISORY",
    "purpose": "research",
    "sensitivity_class": "SYNTHETIC",
    "candidate_providers": [
      {
        "provider": "LOCAL",
        "state": "NOT_TESTED"
      },
      {
        "provider": "AMAZON_BEDROCK",
        "state": "IMPLEMENTED"
      },
      {
        "provider": "OPENROUTER",
        "state": "NOT_TESTED"
      }
    ],
    "candidate_models": [
      "amazon.nova-micro-v1:0"
    ],
    "selected_provider": "AMAZON_BEDROCK",
    "selected_model": "amazon.nova-micro-v1:0",
    "selection_reason": "Dynamically discovered low-cost text model suitable for bounded synthetic advisory inference.",
    "privacy_constraint": "SYNTHETIC_ONLY",
    "cost_class": "LOW",
    "latency_class": "INTERACTIVE",
    "fallback_order": [
      "AMAZON_BEDROCK",
      "LOCAL",
      "OPENROUTER"
    ],
    "routing_policy_version": "MEND_MODEL_ROUTING_V1"
  },
  "parent_fco_ids": [
    "fco_05f1239a4cd12466d0aa8410024adf92661fdba1e3131b756455a43447065b94"
  ],
  "purpose": "research",
  "sensitivity_class": "SYNTHETIC",
  "transformation": "POLICY_AWARE_ROUTE_SELECTION",
  "executor": "MEND_ROUTER_V1",
  "provider": "AMAZON_BEDROCK",
  "model_id": "amazon.nova-micro-v1:0",
  "model_version": "1:0",
  "inference_profile": "us.amazon.nova-micro-v1:0",
  "prompt_sha256": "1fd4fa34e58439f5658cf20761fe9b5ed9021669ac7c8fe398465f105d1a5caf",
  "parameters_sha256": "8df024c360814db5d685e9bb384b0bba6a13aee7b8fc9207280e677da1264995",
  "input_sha256": "05f1239a4cd12466d0aa8410024adf92661fdba1e3131b756455a43447065b94",
  "verification_state": "SUPPORTED",
  "release_state": "NOT_COMPUTED",
  "policy_ref": "MEND_MODEL_ROUTING_V1",
  "provenance_refs": [
    "fco_05f1239a4cd12466d0aa8410024adf92661fdba1e3131b756455a43447065b94"
  ],
  "breakpoint_ref": "NOT_COMPUTED"
}
