{
  "fco_id": "fco_62a8c339b0bf1299d000e2d4369fcb0251d4bd02cb7138e91f4122a46fc1cce7",
  "content_sha256": "62a8c339b0bf1299d000e2d4369fcb0251d4bd02cb7138e91f4122a46fc1cce7",
  "fco_type": "SOURCE_FCO",
  "canonicalization": "RFC8785-like JSON: UTF-8, sorted keys, separators comma/colon, ensure_ascii=false",
  "execution_state": "OBSERVED",
  "payload": {
    "logical_path": "data/core/synthetic_fhir_bundle.json",
    "media_type": "application/fhir+json",
    "record_class": "synthetic_fixture"
  },
  "parent_fco_ids": [],
  "source_ref": "data/core/synthetic_fhir_bundle.json",
  "source_date": "2026-09-26",
  "retrieval_time": "2026-09-26T00:00:00Z",
  "creation_time": "2026-09-26T00:00:00Z",
  "freshness_days": 0,
  "freshness_class": "FRESH",
  "rights_class": "PUBLIC_REPOSITORY_FIXTURE",
  "sensitivity_class": "SYNTHETIC",
  "purpose": "research",
  "transformation": "IDENTITY",
  "executor": "MEND_DETERMINISTIC_ATOMIZER_V1",
  "input_sha256": "80fc1fbb5eb3f600435cbc6353189bd9716240e42cda94f8d375585d36c78a9a",
  "verification_state": "SUPPORTED",
  "release_state": "NOT_COMPUTED",
  "policy_ref": "MEND_SYNTHETIC_RESEARCH_V1",
  "provenance_refs": [
    "data/core/synthetic_fhir_bundle.json"
  ],
  "breakpoint_ref": "MEND_CORE_20260926_B1"
}
