{
  "fco_id": "fco_88b65774fb6a029d52265eb42cd19b60d9a473c769a525be948dfa374a155f55",
  "content_sha256": "88b65774fb6a029d52265eb42cd19b60d9a473c769a525be948dfa374a155f55",
  "fco_type": "MODEL_RESULT_FCO",
  "canonicalization": "RFC8785-like JSON: UTF-8, sorted keys, separators comma/colon, ensure_ascii=false",
  "execution_state": "OBSERVED",
  "payload": {
    "advisory_text": "Based on the provided synthetic summary, one bounded research advisory observation is that the dataset includes a diverse range of five resources, encompassing Condition, Observation, and Patient types, which could be valuable for comprehensive health-related research studies.",
    "claim_boundary": "Probabilistic advisory over synthetic data; not clinical guidance."
  },
  "parent_fco_ids": [
    "fco_3e151e054053602dc1367cadeee1c85711bf34da22cbb374823530602c8df342"
  ],
  "purpose": "research",
  "sensitivity_class": "SYNTHETIC",
  "transformation": "BEDROCK_MODEL_INFERENCE",
  "executor": "AMAZON_BEDROCK_RUNTIME",
  "provider": "AMAZON_BEDROCK",
  "model_id": "amazon.nova-micro-v1:0",
  "model_version": "1:0",
  "inference_profile": "us.amazon.nova-micro-v1:0",
  "prompt_sha256": "1fd4fa34e58439f5658cf20761fe9b5ed9021669ac7c8fe398465f105d1a5caf",
  "parameters_sha256": "8df024c360814db5d685e9bb384b0bba6a13aee7b8fc9207280e677da1264995",
  "input_sha256": "d8a103cc298b22ccf90fec5e8c2002a64cc631e4891d016d79986c1b8dc6f169",
  "execution_started": "2026-09-26T19:13:48.857193Z",
  "execution_finished": "2026-09-26T19:13:50.036238Z",
  "latency_ms": 1178,
  "result_sha256": "166ae30f5e902b6e39c5fd7249daacec6a8b4927b04ca894cce9401a3b248f09",
  "verification_state": "NOT_COMPUTED",
  "release_state": "NOT_COMPUTED",
  "policy_ref": "MEND_MODEL_ROUTING_V1",
  "provenance_refs": [
    "fco_3e151e054053602dc1367cadeee1c85711bf34da22cbb374823530602c8df342"
  ],
  "breakpoint_ref": "MEND_MODEL_ROUTE_BREAKPOINT_V1"
}
