{
  "fco_id": "fco_05f1239a4cd12466d0aa8410024adf92661fdba1e3131b756455a43447065b94",
  "content_sha256": "05f1239a4cd12466d0aa8410024adf92661fdba1e3131b756455a43447065b94",
  "fco_type": "MODEL_REQUEST_FCO",
  "canonicalization": "RFC8785-like JSON: UTF-8, sorted keys, separators comma/colon, ensure_ascii=false",
  "execution_state": "PROPOSED",
  "payload": {
    "task_class": "BOUNDED_SYNTHETIC_HEALTH_ADVISORY",
    "prompt": "Using only this synthetic summary, provide one bounded research advisory observation. Do not infer identity, diagnosis, treatment, compliance, or clinical validity. Summary: {\"fixture_sha256\": \"80fc1fbb5eb3f600435cbc6353189bd9716240e42cda94f8d375585d36c78a9a\", \"resource_count\": 5, \"resource_types\": [\"Condition\", \"Observation\", \"Patient\"]}",
    "parameters": {
      "maxTokens": 160,
      "temperature": 0.0
    }
  },
  "parent_fco_ids": [
    "fco_d8a103cc298b22ccf90fec5e8c2002a64cc631e4891d016d79986c1b8dc6f169"
  ],
  "purpose": "research",
  "sensitivity_class": "SYNTHETIC",
  "transformation": "REQUEST_ADVISORY",
  "executor": "MEND_ROUTER_V1",
  "provider": "UNKNOWN",
  "model_id": "UNKNOWN",
  "model_version": "UNKNOWN",
  "inference_profile": "UNKNOWN",
  "prompt_sha256": "1fd4fa34e58439f5658cf20761fe9b5ed9021669ac7c8fe398465f105d1a5caf",
  "parameters_sha256": "8df024c360814db5d685e9bb384b0bba6a13aee7b8fc9207280e677da1264995",
  "input_sha256": "d8a103cc298b22ccf90fec5e8c2002a64cc631e4891d016d79986c1b8dc6f169",
  "verification_state": "NOT_COMPUTED",
  "release_state": "NOT_COMPUTED",
  "policy_ref": "MEND_MODEL_ROUTING_V1",
  "provenance_refs": [
    "fco_d8a103cc298b22ccf90fec5e8c2002a64cc631e4891d016d79986c1b8dc6f169"
  ],
  "breakpoint_ref": "MEND_SOURCE_ATOM_BREAKPOINT_V1"
}
