{
  "fco_id": "fco_1f002e9c6c4314e5c30af4d8f0a11dfb07be7c59896c14264e26e9509ad373e0",
  "content_sha256": "1f002e9c6c4314e5c30af4d8f0a11dfb07be7c59896c14264e26e9509ad373e0",
  "fco_type": "BREAKPOINT_FCO",
  "canonicalization": "RFC8785-like JSON: UTF-8, sorted keys, separators comma/colon, ensure_ascii=false",
  "execution_state": "OBSERVED",
  "payload": {
    "breakpoint_id": "MEND_RELEASE_BREAKPOINT_V1",
    "merkle_root_sha256": "270616cea4872be7f359b505a89fe4b18e2736e92f9026d457bea7695bc31b38",
    "leaf_count": 3
  },
  "parent_fco_ids": [
    "fco_d2d5406cae5e72b1f8f5a23ef8f641f3a587985fcb94115432cfd74db0f1c5ad"
  ],
  "purpose": "research",
  "sensitivity_class": "PUBLIC_SYNTHETIC_OUTPUT",
  "transformation": "MERKLE_SEAL",
  "executor": "MEND_BREAKPOINT_ENGINE_V1",
  "provider": "LOCAL",
  "model_id": "NULL",
  "input_sha256": "d2d5406cae5e72b1f8f5a23ef8f641f3a587985fcb94115432cfd74db0f1c5ad",
  "verification_state": "SUPPORTED",
  "release_state": "SUPPORTED",
  "policy_ref": "MEND_BREAKPOINT_POLICY_V1",
  "provenance_refs": [
    "breakpoints/bp6_mend_release_breakpoint_v1.json"
  ],
  "breakpoint_ref": "MEND_RELEASE_BREAKPOINT_V1"
}
